### ISSUE TITLE
v 4.1.5 - 304 responses not forwarded to client

### ISSUE THREAD

**Issue by resoli** [e2guardian/e2guardian#477]
Hello, I am facing this in 4.1.2, I hope you are still accepting bug reports for that version.

I observed that 304 responses from upstream proxy are not forwarded to client. For example for this request from 192.168.11.19 client, collected with tcpdump on 192.168.10.201 e2guardian host:

```
11:52:00.659485 IP 192.168.11.19.49471 > 192.168.10.201.8080: Flags [P.], seq 1:485, ack 1, win 513, length 484: HTTP: GET http://172.21.220.129:8080/Portale/images/login_gpi_top.jpg HTTP/1.1
	0x0000:  4500 020c 1778 4000 7f06 4b47 c0a8 0b13  E....x@...KG....
	0x0010:  c0a8 0ac9 c13f 1f90 76af e88c 72b2 4b71  .....?..v...r.Kq
	0x0020:  5018 0201 bec5 0000 4745 5420 6874 7470  P.......GET.http
	0x0030:  3a2f 2f31 3732 2e32 312e 3232 302e 3132  ://172.21.220.12
	0x0040:  393a 3830 3830 2f50 6f72 7461 6c65 2f69  9:8080/Portale/i
	0x0050:  6d61 6765 732f 6c6f 6769 6e5f 6770 695f  mages/login_gpi_
	0x0060:  746f 702e 6a70 6720 4854 5450 2f31 2e31  top.jpg.HTTP/1.1
	0x0070:  0d0a 4163 6365 7074 3a20 2a2f 2a0d 0a41  ..Accept:.*/*..A
	0x0080:  6363 6570 742d 4c61 6e67 7561 6765 3a20  ccept-Language:.
	0x0090:  6974 2d49 540d 0a55 7365 722d 4167 656e  it-IT..User-Agen
	0x00a0:  743a 204d 6f7a 696c 6c61 2f34 2e30 2028  t:.Mozilla/4.0.(
	0x00b0:  636f 6d70 6174 6962 6c65 3b20 4d53 4945  compatible;.MSIE
	0x00c0:  2037 2e30 3b20 5769 6e64 6f77 7320 4e54  .7.0;.Windows.NT
	0x00d0:  2036 2e31 3b20 574f 5736 343b 2054 7269  .6.1;.WOW64;.Tri
	0x00e0:  6465 6e74 2f37 2e30 3b20 534c 4343 323b  dent/7.0;.SLCC2;
	0x00f0:  202e 4e45 5420 434c 5220 322e 302e 3530  ..NET.CLR.2.0.50
	0x0100:  3732 373b 202e 4e45 5420 434c 5220 332e  727;..NET.CLR.3.
	0x0110:  352e 3330 3732 393b 202e 4e45 5420 434c  5.30729;..NET.CL
	0x0120:  5220 332e 302e 3330 3732 393b 204d 6564  R.3.0.30729;.Med
	0x0130:  6961 2043 656e 7465 7220 5043 2036 2e30  ia.Center.PC.6.0
	0x0140:  3b20 2e4e 4554 342e 3043 3b20 2e4e 4554  ;..NET4.0C;..NET
	0x0150:  342e 3045 290d 0a41 6363 6570 742d 456e  4.0E)..Accept-En
	0x0160:  636f 6469 6e67 3a20 677a 6970 2c20 6465  coding:.gzip,.de
	0x0170:  666c 6174 650d 0a50 726f 7879 2d43 6f6e  flate..Proxy-Con
	0x0180:  6e65 6374 696f 6e3a 204b 6565 702d 416c  nection:.Keep-Al
	0x0190:  6976 650d 0a49 662d 4d6f 6469 6669 6564  ive..If-Modified
	0x01a0:  2d53 696e 6365 3a20 4672 692c 2030 3320  -Since:.Fri,.03.
	0x01b0:  4a75 6c20 3230 3039 2031 303a 3131 3a30  Jul.2009.10:11:0
	0x01c0:  3020 474d 540d 0a49 662d 4e6f 6e65 2d4d  0.GMT..If-None-M
	0x01d0:  6174 6368 3a20 572f 2233 3332 3837 2d31  atch:.W/"33287-1
	0x01e0:  3234 3636 3135 3836 3030 3030 220d 0a48  246615860000"..H
	0x01f0:  6f73 743a 2031 3732 2e32 312e 3232 302e  ost:.172.21.220.
	0x0200:  3132 393a 3830 3830 0d0a 0d0a            129:8080....
11:52:00.659494 IP 192.168.10.201.8080 > 192.168.11.19.49471: Flags [.], ack 485, win 237, length 0
	0x0000:  4500 0028 68be 4000 4006 3ae5 c0a8 0ac9  E..(h.@.@.:.....
	0x0010:  c0a8 0b13 1f90 c13f 72b2 4b71 76af ea70  .......?r.Kqv..p
	0x0020:  5010 00ed 9747 0000                      P....G..

```

the squid upstream proxy log reports:

```
Tue Nov 20 11:52:00 2018.659      0 192.168.11.19 TCP_INM_HIT/304 273 GET http://172.21.220.129:8080/Portale/images/login_gpi_top.jpg - HIER_NONE/- image/jpeg
```

But no 304 is ever forwarded to the 192.168.11.19 client.

**Comment by resoli** [comment]
I correct myself, 304 is received, but only after a couple of minutes:

```
12:11:25.247328 IP 192.168.11.19.49516 > 192.168.10.201.8080: Flags [P.], seq 1:485, ack 1, win 513, length 484: HTTP: GET http://172.21.220.129:8080/Portale/images/login_gpi_top.jpg HTTP/1.1
        0x0000:  4500 020c 1927 4000 7f06 4998 c0a8 0b13  E....'@...I.....
        0x0010:  c0a8 0ac9 c16c 1f90 178d 49d1 4992 36bb  .....l....I.I.6.
        0x0020:  5018 0201 fa4c 0000 4745 5420 6874 7470  P....L..GET.http
        0x0030:  3a2f 2f31 3732 2e32 312e 3232 302e 3132  ://172.21.220.12
        0x0040:  393a 3830 3830 2f50 6f72 7461 6c65 2f69  9:8080/Portale/i
        0x0050:  6d61 6765 732f 6c6f 6769 6e5f 6770 695f  mages/login_gpi_
        0x0060:  746f 702e 6a70 6720 4854 5450 2f31 2e31  top.jpg.HTTP/1.1
        0x0070:  0d0a 4163 6365 7074 3a20 2a2f 2a0d 0a41  ..Accept:.*/*..A
        0x0080:  6363 6570 742d 4c61 6e67 7561 6765 3a20  ccept-Language:.
        0x0090:  6974 2d49 540d 0a55 7365 722d 4167 656e  it-IT..User-Agen
        0x00a0:  743a 204d 6f7a 696c 6c61 2f34 2e30 2028  t:.Mozilla/4.0.(
        0x00b0:  636f 6d70 6174 6962 6c65 3b20 4d53 4945  compatible;.MSIE
        0x00c0:  2037 2e30 3b20 5769 6e64 6f77 7320 4e54  .7.0;.Windows.NT
        0x00d0:  2036 2e31 3b20 574f 5736 343b 2054 7269  .6.1;.WOW64;.Tri
        0x00e0:  6465 6e74 2f37 2e30 3b20 534c 4343 323b  dent/7.0;.SLCC2;
        0x00f0:  202e 4e45 5420 434c 5220 322e 302e 3530  ..NET.CLR.2.0.50
        0x0100:  3732 373b 202e 4e45 5420 434c 5220 332e  727;..NET.CLR.3.
        0x0110:  352e 3330 3732 393b 202e 4e45 5420 434c  5.30729;..NET.CL
        0x0120:  5220 332e 302e 3330 3732 393b 204d 6564  R.3.0.30729;.Med
        0x0130:  6961 2043 656e 7465 7220 5043 2036 2e30  ia.Center.PC.6.0
        0x0140:  3b20 2e4e 4554 342e 3043 3b20 2e4e 4554  ;..NET4.0C;..NET
        0x0150:  342e 3045 290d 0a41 6363 6570 742d 456e  4.0E)..Accept-En
        0x0160:  636f 6469 6e67 3a20 677a 6970 2c20 6465  coding:.gzip,.de
        0x0170:  666c 6174 650d 0a50 726f 7879 2d43 6f6e  flate..Proxy-Con
        0x0180:  6e65 6374 696f 6e3a 204b 6565 702d 416c  nection:.Keep-Al
        0x0190:  6976 650d 0a49 662d 4d6f 6469 6669 6564  ive..If-Modified
        0x01a0:  2d53 696e 6365 3a20 4672 692c 2030 3320  -Since:.Fri,.03.
        0x01b0:  4a75 6c20 3230 3039 2031 303a 3131 3a30  Jul.2009.10:11:0
        0x01c0:  3020 474d 540d 0a49 662d 4e6f 6e65 2d4d  0.GMT..If-None-M
        0x01d0:  6174 6368 3a20 572f 2233 3332 3837 2d31  atch:.W/"33287-1
        0x01e0:  3234 3636 3135 3836 3030 3030 220d 0a48  246615860000"..H
        0x01f0:  6f73 743a 2031 3732 2e32 312e 3232 302e  ost:.172.21.220.
        0x0200:  3132 393a 3830 3830 0d0a 0d0a            129:8080....
12:11:25.247342 IP 192.168.10.201.8080 > 192.168.11.19.49516: Flags [.], ack 485, win 237, length 0
        0x0000:  4500 0028 a3a1 4000 4006 0002 c0a8 0ac9  E..(..@.@.......
        0x0010:  c0a8 0b13 1f90 c16c 4992 36bb 178d 4bb5  .......lI.6...K.
        0x0020:  5010 00ed 9747 0000                      P....G..
12:13:25.000520 IP 192.168.10.201.8080 > 192.168.11.19.49516: Flags [P.], seq 1:28, ack 485, win 237, length 27: HTTP: HTTP/1.1 304 Not Modified
        0x0000:  4500 0043 a3a2 4000 4006 ffe5 c0a8 0ac9  E..C..@.@.......
        0x0010:  c0a8 0b13 1f90 c16c 4992 36bb 178d 4bb5  .......lI.6...K.
        0x0020:  5018 00ed 9762 0000 4854 5450 2f31 2e31  P....b..HTTP/1.1
        0x0030:  2033 3034 204e 6f74 204d 6f64 6966 6965  .304.Not.Modifie
        0x0040:  640d 0a 
```

**Comment by philipianpearce** [comment]
This sounds like a timing bug.   Unfortunately I'm unable to help with any bugs in v4.1.2 as the old logic code is very convoluted and there is a danger of breaking the logic by making changes.  First of all I would suggest that you update to the latest v4.1 (v4.1.5).    If that does not fix it then think about leaping to v5.2!

Regards
Philip

**Comment by resoli** [comment]
Il 5 dicembre 2018 18:23:17 CET, Philip Pearce <notifications@github.com> ha scritto:
>This sounds like a timing bug. Unfortunately I'm unable to help with
>any bugs in v4.1.2 as the old logic code is very convoluted and there
>is a danger of breaking the logic by making changes. First of all I
>would suggest that you update to the latest v4.1 (v4.1.5). If that
>does not fix it then think about leaping to v5.2!

Yes, I am focusing more on 5.2.2. now, but I have some other problems there ... #481.

Thanks,
rob

**Comment by fredbcode** [comment]
Can I close this ?

**Comment by resoli** [comment]
Yes. Sorry for late response.
